title,author,subreddit
"What commonly accepted wisdom about what makes a man attractive do you disagree with? Conversely, what traits are you attracted to, that you think are undervalued by most other women?",C4TERW4L,AskWomen
How do I deal with having to interact with my bfs coworker who made me uncomfortable??,throwawayalientk,AskWomen
How do I deal with having to interact with my bfs coworker who made me really uncomfortable once,throwawayalientk,AskWomen
For those who have gone to AA meetings is there a major difference between women only and coed meetings?,Exact_Roll_4048,AskWomen
What are signs that your wife/girlfriend hates you?,Unfair_Salad_5521,AskWomen
How come you always want to buy a new top or similar when it's time to party? Even though you have 20 in the closet.,ricuncle,AskWomen
Where do women in their late 20s socialize?,Succotash5,AskWomen
Who else absolutely hates clothes?,tina-snowww,AskWomen
What is your review of this website?,WorthYard3128,AskWomen
which manscaping do you prefer?,SlatedMortician,AskWomen
What are your thoughts on dating an 'over the road' trucker? Is that something you'd ever consider or is it off the table?,TheSaltyPineapple1,AskWomen
"What's your ""my mama taught me better than that"" moment?",Obvious_Rip_2709,AskWomen
How to deal with a cold sore? First time getting one,siththevi,AskWomen
How do you feel about uncut guys?,forestmusk,AskWomen
How uncommon or common is it for women to genuinely enjoy being a domme?,shadow_walker1925,AskWomen
How do you know you’re in love?,ostrichworld,AskWomen
I'm a communications professional but I don't like writing. How many others feel like they're in the wrong profession?,jadebagua,AskWomen
Hey gals! I need advices. How were you able to convince yourself to have a fling instead of a relationship?,SailorMoon559,AskWomen
Who genuinely enjoys being a Domme?,shadow_walker1925,AskWomen
Casual Convo Fridays,AutoModerator,AskWomen
What is your fav way to express your femininity?,sunnyrenee,AskWomen
Do any women prefer girth over length? Which feels better for you?,tina-snowww,AskWomen
Ok i'm new here and I need some advice part 1....... I just started talking to this guy and he asked me a question I wasn't comfortable with so he asked me if I trusted him and I answered truthfully and said no (because why would I trust someone I've know for only a week),Her_nameMIA,AskWomen
"If you broke up with a partner and later regretted your decision, how did you handle that situation?",artjazzandsoul,AskWomen
What are your opinions on pubic hair on men?,curiouslansing,AskWomen
How was your libido effected after having an abortion?,savingprivateorange,AskWomen
What are you watching? Recommend strong female lead shows!,[deleted],AskWomen
"[M15] Question - I just wonder what girls like about us, is it how we act, look, talk? I just want to understand the perspective.",Skripzy,AskWomen
How do you sort your clothes in the laundry?,forgot_username321,AskWomen
What instead of flowers would you prefer?,Derpy7664,AskWomen
What do women like in bald men?,metalvendetta,AskWomen
Why do you say no to your partner?,seph1288,AskWomen
Why are you in reddit?,Sweaty_Ad_1420,AskWomen
Am I the only one who hates being fingered?,tina-snowww,AskWomen
How long to wait?,kittirawr,AskWomen
What is the strangest/funniest thing someone has done on a date with you?,corakken,AskWomen
"Have you ever met a sincerely good bf/guy/girl after being ""picked up"" on the street? How?",nftsPowersx,AskWomen
When or is looks enough to sleep with a relative stranger?,Blackgod_Kurokami,AskWomen
What do you think of Taurus women? In honor of Taurus season!,tina-snowww,AskWomen
What separates a sweet romantic partner from a pushover?,marty_mcclarkey_1791,AskWomen
"I’m [24M] scared I will be rejected for having no experience. When should I disclose it, if at all",osnalpp,AskWomen
Why do most women like doggie style position?,ResolveClean252,AskWomen
What are the main differences you notice with men and women in ways they feel and express their attraction?,drgnlxrd,AskWomen
Has what you look for in a partner changed as you’ve grown older?,Janet-Snakehole666,AskWomen
What am I doing wrong and how can I fix it?,Negative-End7922,AskWomen
What made you swoon ?,DRKSEEKERS,AskWomen
what made you swoon,DRKSEEKERS,AskWomen
At what age did you meet your s/o and how did it happen?,alwaysa182,AskWomen
At what age did you meet “the one” and how did you meet?,[deleted],AskWomen
"Why, oh why, do girls miss you after you just saw them?",Apprehensive-Cry894,AskWomen
"Ladies who dated the school bully, How did that relationship go?",NathosOner,AskWomen
How often do you masturbate ?,cringey_boy69,AskWomen
"[Serious] Women who have joined music band tour bus entourages, what happens when you get to the next tour city and a new group of women wants to join the bands tour bus entourage?",wing_growingpains,AskWomen
How often do you masturbate,cringey_boy69,AskWomen
How do you know when you found “the one”?,alwaysa182,AskWomen
What does it feel like to sit with big butt?,nolpeter,AskWomen
How often does your partner clean?,Fuckeyed4Less,AskWomen
What’s the quickest and best way to get over someone?,pomin-p,AskWomen
What is my sexuality …?,DisciplineCreative24,AskWomen
Have you ever been with a man who you wanted to be with but you knew you will never be enough for him?,discofeast,AskWomen
Why does my best friend (both female) always mention kissing and stuff when she’s drunk?,Dapper-Collection672,AskWomen
How to tell someone you’re not interested in a closer friendship?,throwfaraway1515,AskWomen
Which intuitions/ hunches most of the time we’re true or correct?,airamam23,AskWomen
"Women who were betrayed by people close to them, what's your story ?",Silly-XboxGamerTag,AskWomen
how do you break up with someone who's still into you,longalongass,AskWomen
What Intuition/hunch,airamam23,AskWomen
what outfit do you wish men always/never wear?,Silly-XboxGamerTag,AskWomen
How would you like a none traditional engagement ring???,throwawaybuyer0,AskWomen
"Other than breasts/cleavage, what other body part do you catch men staring at or catching a glimpse of?",t480,AskWomen
Why are the only subreddits for biological women centered around pornography?,DifferentlyEqual,AskWomen
When giving Hugs: do you pat-pat-pat or just snuggle in close?,malaprop5,AskWomen
"Many women guide young ladies, but what is advice you would give young men and teenage guys",Slornip,AskWomen
How did losing weight change your life?,sebastiandarke,AskWomen
What would you tell someone in their early 20’s?,Fit_Dependent_565,AskWomen
How long should a guy wait before approaching another girl after rejection?,ListNo9585,AskWomen
What advice would you give to young women in their early 20’s in any aspect?,Fit_Dependent_565,AskWomen
what is your favourite moment of your SO being goofy?,addeleijon,AskWomen
How long should a guy wait before approaching another girl after rejection,ListNo9585,AskWomen
How to not be boring?,deathofmusic,AskWomen
How old were you when you had your first real relationship?,Anxious_Car1689,AskWomen
"When guys don't check you out, will you get sad?",confipete,AskWomen
How do I turn down a hang-out invite?,Aggravating_Ice3017,AskWomen
What causes random breast pain?,Internal_Aardvark220,AskWomen
What can I guy do while dating that gives you the ick?,_everlong_,AskWomen
What is the truth?,Emergency_Length5739,AskWomen
What do you think about men with facial hair?,FreeThrowFrom69,AskWomen
How to know if my “assets” are above/below/at average for my body type?,IndependentDot7427,AskWomen
In what circumstances do women like facial hair on men?,FreeThrowFrom69,AskWomen
Why are there so many rules here I can barely ask any questions from women Perspective,Fresh-Beginning6597,AskWomen
I here women saying they prefer being approached in real live then on dating apps why is that?,Fresh-Beginning6597,AskWomen
How do you set boundaries?,ivy818,AskWomen
What advice would you give guys who are confused about how a woman is acting?,Efficient_Cheetah_61,AskWomen
What is the best way to ask a girl you’re dating to remove body hair?,Discobison102,AskWomen
Y’all know how scary its to approach y’all?,Fresh-Beginning6597,AskWomen
a guy literally said maybe we can keep each other company tonight. I oddly got the ick. Why am I like this? Does anyone understand?,_everlong_,AskWomen
What is the most effective wax strip you guys have ever used? I’m a first timer. Need help! 🥲,randomshi8,AskWomen
When and what’s the best method to approach y’all ? It’s scary when y’all in group. Or should just stick to online dating?,Justdoingit99,AskWomen
What makes you productive on days that you feel unmotivated?,not_nebraska,AskWomen
Why do prefer to stay single?,boredbobbi,AskWomen
Why have you stopped dating or entertaining men?,FoxDisastrous5219,AskWomen
What word or phrase makes you feel great every time you hear it or read it?,ConcreteViewMedia,AskWomen
What’s your favorite film trilogy?,Balanceblu,AskWomen
How to get over a guy you had potential with?,bjkork,AskWomen
How do you cope with your body insecurity? Did it help?,Technical-Reply852,AskWomen
"Tough choice for our women in late 20s or early 30s. What would you chose: Get into a long term stable relationship with someone you’re not physically attracted to, but have similar interests and financial compatibility OR take a huge risk of ending up being single for a long period of time?",throwaway_acc0nt,AskWomen
What is the most amount of orgasms you’ve had during sex?,toreconcileornotto,AskWomen
How do I know if a girl is flirting with me?,MlgDoge1337,AskWomen
What to do? Coworker trying to set me up with another- advice?,dukecrazie34,AskWomen
"When you ask a man if he’s punched a wall before, there’s a decent chance he’ll say yes. Is this the same for women?",potoghi,AskWomen
"Ladies, do you like it when a man appreciates your boobs?",TheZavMan,AskWomen
"Betrayal... after 5 years, 2 cats, 2 moves, and many memories (... and shared rent in a pricey neighborhood). What now...?",Artemis_Is_Law,AskWomen
"Betrayal... after 5 years, 2 cats, 2 moves, and many memories (... and shared rent in a pricey neighborhood). What now...",Artemis_Is_Law,AskWomen
"Betrayal... after 5 years, 2 cats, 2 moves, and many memories (... and shared rent in a pricey neighborhood). What now?",Artemis_Is_Law,AskWomen
What is your comfort food during your period?,Mizuki928,AskWomen
"Woman who gave their ex a second chance, how did it turn out?",Pretend-Incident2015,AskWomen
"Women with tattoos, what was your family/ friend's response",AwesomeAudi,AskWomen
What will happen when someone tried to date a man with severe mommy issues and attachment issues?,for3skindonor,AskWomen
when you feel that like tension/attraction are you the only one feeling it?,runningperfumecoffee,AskWomen
"Women of Reddit who are married or are in a relationship with someone of a different religion or are irreligious, how is it going?",kitty_withlazers,AskWomen
why am I over reacting to my crush situation?,BlackPillSurrender,AskWomen
"Women who are, or have been, pregnant - what do/did you need most from your spouse?",newfatherthrowaway22,AskWomen
How to determine if someone is shallow?,HoWaReYoUdOuInG,AskWomen
How do you reach orgasm during vaginal sex/penetration?,Cool-Interview3231,AskWomen
What's your Opinion on Men using Snapchat Filters to Look More Attractive?,DiscombobulatedEbb33,AskWomen
what do girls like in a guy that don't involve looks?,meyspetfroge,AskWomen
What am I doing wrong with this tampon,ImagineBacon78,AskWomen
What constitutes cheating to you?,thingymajig,AskWomen
What’s your favorite part of your body?,honeyeyedgal,AskWomen
Women who come from troubled backgrounds: how did you gain your confidence?,honeyeyedgal,AskWomen
What do you think about a thin person as a potential romantic partner?,Shooter__McDabbin,AskWomen
what is next after a 3rd date ?,ughtycutie,AskWomen
How would you feel about dating a thin person?,Shooter__McDabbin,AskWomen
what you say when I am being ignored after 3 dates?,ughtycutie,AskWomen
How to get my GF to shave her Mustache?,LamaLover999,AskWomen
what would you suggest if I am being ignored after 3 dates,ughtycutie,AskWomen
What would you do if you happened upon a friend having sex?,lopeeppa,AskWomen
How to get my GF to shave her mustache,LamaLover999,AskWomen
"why men are like this? ,after 3 wonderful dates and all they do is ignore ?",ughtycutie,AskWomen
"women of reddit, what the female version of cockblocking?",Immediate_Sun_8436,AskWomen
Why am I still dealing with long Covid effects?,Poodlerocks,AskWomen
How would you feel about dating a thin guy?,Shooter__McDabbin,AskWomen
How wrong is it to be friends with my sister’s ex bf who caused her a lot of problems ?,MichaGlare,AskWomen
"Women, what is a difference between you and your partner and why do you like/dislike it?",-CovetedAmber-,AskWomen
How do you feel about dating future?,HoWaReYoUdOuInG,AskWomen
Is it considered wrong if my sister is friends with my ex Bf who gave me a lot of problems in life ?,MichaGlare,AskWomen
What is the last thing that u regret doing ?,Willing_Variety_4784,AskWomen
"Women with large breasts, what company has the best quality / most comfortable Bra's you can find? (other than Victoria's secret)",Undermost_Drip,AskWomen
Worst grade you got in middle/high school and why?,BeeSpams,AskWomen
What is one thing that you regret doing in middle/high school?,BeeSpams,AskWomen
What does this mean?,Shot_Bus_1559,AskWomen
How do you know if a guy could be interested in you?,groundzero03,AskWomen
What can fathers do to keep a good relationship with their daughter?,JayReddt,AskWomen
"Women of Reddit, what is your favourite ASMR channel if you watch it?",Chick0596,AskWomen
"When you feel your self doubt rising, how do you lift yourself back up again? And how successful do you find your methods?",whiskmeoffmyfeet,AskWomen
How can I make online friendships with women that are much older than me?,Enriched_flour,AskWomen
Have you or anyone who you know experienced an ovarian cyst rupture before?,Judgementfree_,AskWomen
"When will my sex drive return after stopping the pill? I have been off it for 4 months now and feel completely numb to anything sexual, I’m worried it will never return! Please can anyone share their experiences?",Individual_Top5607,AskWomen
"How often do you wash your hair with shampoo/conditioner? What do you do on ""non wash"" days?",miaxoxo123,AskWomen
What are some good long distance/virtual dates?,Jamboree76,AskWomen
When do tampons and/or pads require post-insertion/post-application adjustment?,ReadyInterest,AskWomen
What were your childhood dreams and what do you do now?,Whateveridontkare,AskWomen
"What age were you when you first got Botox? If you were under 30, do you have any regrets?",Empty_Comparison_508,AskWomen
how did you figure out what gives you the most pleasure in bed and learn how to communicate it to your partner?,sparklyflowercrowns,AskWomen
What are some fun things to do this summer without friends?,thefourthpowerpuff,AskWomen
Women of Reddit - do drag queens offend you? why or why not?,gladthatisover0,AskWomen
What are some signs someone is a good friend?,Cute_Character_1603,AskWomen
In what situation do you feel most insecure?,Starlightt04,AskWomen
"When someone says you look well, what do you interpret it as?",BubbleWrapWaffle,AskWomen
Should I smooth things over with her? Need help what to do,chocosyrupinmilk,AskWomen
why girlfriend says she wants to watch me have sex with other women?,leekee_bum,AskWomen
"Women of Reddit, what do you like to top your pancakes with?",Chocolate_effort,AskWomen
What is your favourite kind of tree and why?,BaymaxTheBot,AskWomen
"Women who decided to stop masturbating, what happened?",OrganicGas4568,AskWomen
Who would like a pen pal ?,Fun-Bird6820,AskWomen
Who would like a pen pal,Fun-Bird6820,AskWomen
Who likes big guys?,Conscious_Annual292,AskWomen
WHY AM I CRYING SO MUCH ON MY PERIOD I CANT STOP OMG,Xlunaxz,AskWomen
What Have your experiences with Better Help and The Calm App been? Were they worth the money?,Lennyhi,AskWomen
"Women who willingly stopped having sex, what happened?",OrganicGas4568,AskWomen
would you consider sex under false pretense to be rape or just being a horrible person? and why.,PhilosophiaNow,AskWomen
How to bond with women as a man,yCurtisd2,AskWomen
What is your weirdest fetish?,meagainstmyselff,AskWomen
"What do you do when you're having one of those nights where you wanna go all night, but your SO's male anatomy only allows for a set number of rounds?",haze--e,AskWomen
"Straight women of Reddit, do you really not think women are super-sexy and alluring? How is that possible?",Frequent_Blueberry71,AskWomen
What do y'all think about my situation here?,throwaway1111111q,AskWomen
what makes u so horny,Comfortable-Art8774,AskWomen
Why: Give us feedback on our developing app,charlied044,AskWomen
Why can't I ask the most important question I have ever personally had for women?,Educational_Call_546,AskWomen
how much is too much masturbation?,Not_your_hoe_,AskWomen
"What's your favorite ""giving only"" sexual act to perform and why?",motion_bum,AskWomen
Why do I have brown discharge?,Venus_1031,AskWomen
How to change initial to full name on Zoom?,motivationswag,AskWomen
"Is it offensive to you when you, or a group of women are reffered to as 'guys'?",FinishedMyWork,AskWomen
"Women who reported revenge porn to the police, what was the outcome?",iadlfn139u7n,AskWomen
What's up with girlfriend's sketchy male friend?,DatFettyBOI,AskWomen
"How many orgasms do you have when masturbating? Is it one and done, or a 30 second breather and then back to it?",KiahB07,AskWomen
How do you feel about hair extensions when it comes to dating?,OkKoala3241,AskWomen
"If you were on a date and they insisted on walking you to your car, but you didn't want that, how would you get out of it?",Fun_Ambition2197,AskWomen
What makes marriage hard?,mynameisnothers,AskWomen
why don’t women wear dresses more often?,rochesterslim,AskWomen
Women who wear hair extensions,OkKoala3241,AskWomen
"Is it so weird to a attractive, social(17m)and not gay to still virgin? What makes it really weird ,,that everyone I communicate with he aver that I’m not virgin and a fuck boy and all that!",megbll_,AskWomen
"Who is the most conventionally attractive person you know, and what is life like for them?",alttobeembarassing23,AskWomen
How to combat your own internalized misogyny?,Whisdeer,AskWomen
what to do? i have felling for a girl-friend,EducationalTomato651,AskWomen
What vanilla disloyal crap did his friend pull to make sure you guys never get together?,itsmisscherry,AskWomen
"Ladies, what is one regret you have in life?",totallyexceptional,AskWomen
what to do : have felling for a very good girl-friend,EducationalTomato651,AskWomen
Ladies who have been through menopause: what is it like and how does it feel once it's over? Is it better to not have periods any more?,iwantburgersandpizza,AskWomen
"how can I find a lipstick if I can't try it on? for context I have never worn lipstick, most probably because I have fairly thin lips. but I'd like to try, however I don't want to waste my money. how am I supposed to find a lipstick and a lip liner to go with it, if I don't know if I'll like it.",Kimblob,AskWomen
What's the best sleeping position when you have lower back pain on your period?,halpert_pp,AskWomen
How to be feminine ?,Agitated-Subject-207,AskWomen
What’s the most random/trivial fact you remember learning in school?,KeyProperty2134,AskWomen
Why were you jealous of a crush? Did you do anything cringey about it?,iamnauria,AskWomen
How to be feminine,Agitated-Subject-207,AskWomen
What’s the lost random/trivial fact you still remember being taught in school?,KeyProperty2134,AskWomen
Am I pregnant? In which cases would I be? Odds?,zed_laine,AskWomen
Who or what genuinely brings you so much joy?,sssingularityyy,AskWomen
What is a skill/hobby you have learned just because it’s fun?,KeyProperty2134,AskWomen
How do I know if my wife really cares or not ?,DreamOutrageous,AskWomen
What nail coloring “technique” lasts the longest? out of the game for years,M0THER_0F_D0GS,AskWomen
How to get over a heartbreak?,Mediocre_Flamingo747,AskWomen
What does my body my choice mean for men?,ChallengeOk4185,AskWomen
"Hi Ladies, what was the cringiest thing you've done when you had a crush on someone?",iamnauria,AskWomen
How do you shoot your shot??,public_dezire,AskWomen
What,ChallengeOk4185,AskWomen
What do you use to make your inner thighs or around the practice area abit lighter?,maxington-,AskWomen
How would you react if a male friend of yours asked to try on some of your clothes and/or makeup?,jennyraee,AskWomen
when is the best/most ideal time to tell your s/o you love them?,wigglewiggle4s,AskWomen
I 25M see my girlriend 22F of 6 years see each other once a week.. but usually twice a month. What do you think? Is it normal?,Tomislav23,AskWomen
how do you cope up with sadness?,Not_your_hoe_,AskWomen
Do women like men who give head for their own enjoyment?,RurDogAlt,AskWomen
what are the signs of an incel?,Why-are-we-here67,AskWomen
What is your best purchase from Amazon?,PumpkinSpiceCaramela,AskWomen
"if i get off by listening to woman/girl moan audios or ladies with no clothes on. am i bisexual or does this happen with other women too? women who have experienced the same, help?",gregoryhousein,AskWomen
What are some things that are extremely noticeable and if theyre not properly taken care off it screams poor hygine?,Sagitario05,AskWomen
It’s Thersday what’s a small achievement that you’re proud of?,A-Bit-Sad,AskWomen
"Women of reddit, what is your advice to teen moms?",Morigi_ana123,AskWomen
how to make your man feel that you're there for him? i'm a poor communicator and this has affected my relationship. need your advice.,gregoryhousein,AskWomen
How do you distinguish between the person not being right for you or you being picky?,ingwill,AskWomen
What was your story of a person who used to be/is your friend but turned out to be creepy (optional- and in love with you),YouCuteSidehoe,AskWomen
How to not be boring,deathofmusic,AskWomen
Why are forearms with rolled up sleeves more appealing than bare forearms?,Bateman2_,AskWomen
Why are forearms with rolled up sleeves more attractive than bare forearms? They are forearms in both cases,Bateman2_,AskWomen
What are things you like to do in your free time?,stressedout364,AskWomen
What do you think? Does she like me romantically or just being friendly? I’m 25 (M) &lt;-&gt; 36 (F),ravesixheart,AskWomen
Why do girls stick their finger up their BFs ass as a prank?,Weak-Estate5972,AskWomen
"the age old question, which do you like better: converse or vans?",-falafelwaffle-,AskWomen
"As a male, how do I get my hair silky and smooth?",nobleinquiry,AskWomen
Do you think it’s a 🚩 if a man you just met asks “do you live alone?” What’s a good response?,russianindianqueen,AskWomen
What are good alternatives for mascara after eye laser surgery?,Lnndam,AskWomen
"How common is it for women to have a high ""copulation"" drive?",Global_You_9015,AskWomen
How common is it for women to have a high sex drive?,Global_You_9015,AskWomen
When I'm on my period sometimes I can smell myself? Could this be in my head or does EVERYONE smell me??,my-religion-is-love,AskWomen
Apologies if this is a frequent question - who has had skyla or kyleena IUD/or both and would like to share reviews?,informallory,AskWomen
What one thing do you think men take for granted more than anything else?,Cold-Mortgage8100,AskWomen
When’s the last time you got absolutely pounded by your man that your eyes rolled back in your head and the earth moved?,DublinIre80,AskWomen
What are Post sex care solutions,Treadstone100,AskWomen
What negative effects did birth control have on your body?,PxnkLemxnade,AskWomen
Which is The Best Underwear for Women's Health,Alice7525,AskWomen
When did you shoot your shot and get the ✨person✨?,A-Bit-Sad,AskWomen
How should I dispose of used tampons when camping with a composting toilet?,andersoncj23,AskWomen
"What do you think about guys wearing leggings/running tights in the gym or in public places without shorts, but with/without long T shirts?",Demonetizzer,AskWomen
How do relationships work out if the guy &amp; girl have different music tastes?,lifeisshortx,AskWomen
Why am I nothing?,hekdbfbdh,AskWomen
How do you not beat yourself up for your mistakes?,Zeretaaa,AskWomen
How do you gals handle pedicures? My feet are always so tickly when I get them.,Ruthlesstickles,AskWomen
What made you stop masturbating?,PxnkLemxnade,AskWomen
"Ladies who have a friend with benefits, did you ever develop feelings?",EaseTimely,AskWomen
why did being hit in the nipple make me nauseous?,throwthewholepieaway,AskWomen
where is nigera,EnvironmentalTaxDick,AskWomen
why did being hit in the nip make me nauseous,throwthewholepieaway,AskWomen
What’s the most important thing to you on a dating app?,takepityontheloser,AskWomen
"When you had a friends with benefits, did you ever start developing feelings for them?",EaseTimely,AskWomen
"Ladies, how do you usually move on from a breakup and not feel tempted to call your ex when you miss them?",smileurbeautifulx0,AskWomen
Who is being one sided in this friendship? Or am I being dramatic?,Infjanongirl,AskWomen
How attractive in the face do guys have to be in order to compensate for being short?,schittinmycreek,AskWomen
What did your daily routine look like after dealing with debilitating heartbreak?,strawberrykiwi___,AskWomen
"Women of Reddit, What do men do that confuses you?",Individual_Owl_6925,AskWomen
How do I incorporate a silly fetish without turning her off?,Accomplished_Tell,AskWomen
What do you do after heartbreak?,strawberrykiwi___,AskWomen
