title,author,subreddit
"What are some unspoken rules that are actually part of the ""Girl Code?""",ValsBoobs_Fanpage,AskWomen
"What will be your reaction if a 168cm tall, average looking but caring guy who earns more than 200k$ ask you for a date?",Iamyournewdaddy,AskWomen
How many women use panty liners?,throwawayurlyfe9,AskWomen
What can I do to get more friends that are girls?,MouseRatKenobi,AskWomen
what to do if you are in a love and hate relationship? we have been married for 5 years. I love him. he checks all my points but at the same time I cant handle him anymore,_KinkyLady_,AskWomen
"Women earning more than their partner, how has it affected your relationship?",Candid_Comfort_6817,AskWomen
How to deal with friend telling you you'll end up a spinster? Spiralling thoughts.,bluehibiscus00,AskWomen
"how do you feel about the statement"" trans-women are also women""?",Sweet-Mission515,AskWomen
Friend told me I'm most likely going to end up a spinster - Spiralling thoughts - how to deal,bluehibiscus00,AskWomen
What should i do?,Wonderful-Ad1783,AskWomen
idk how to react,Wonderful-Ad1783,AskWomen
What are the actual subtle signs that you give to men that they're supposed to pick up on as you being interested?,Tloc9712,AskWomen
Why can you feel jealousy without actually being jealous?,mercedesvi,AskWomen
How often do you think about sex?,Valuable_Relation_70,AskWomen
What makes Henry Cavill so appealing?,rustycleatus,AskWomen
Earn yourself a Giftcard #Sign up below to how win a Reward.,Straight-Orange-7636,AskWomen
Why is it so hard for me to cut my jealousy?,mercedesvi,AskWomen
how can you identify someone's love language the first time you meet them?,cookred,AskWomen
What's the easiest way to a woman's heart?,Sweet-Mission515,AskWomen
"When you're in the shower, and it has many bugs, is it a possibility that it could climb up there?..",allbvrnz,AskWomen
Why is everyone wearing White Nike Air Force 1’s?,Brent242,AskWomen
How did you discover self pleasure ?(first time),Sweet-Mission515,AskWomen
What do you think (honest opinions) of stretched earlobes?,Mental_Passenger_527,AskWomen
What is your opinion on men with stretched earlobes (even medium sized ones)?,Mental_Passenger_527,AskWomen
How is it a “women owned business” if it’s owned by a married couple?,Getspicy,AskWomen
how to avoid being ghosted?,onlytobelonely,AskWomen
"Women of Reddit, would you be in favor of more guys becoming feminists? Why would you support a this action?",Trauma-Hunter,AskWomen
"Women of Reddit, genuine advice needed please. How long does it take to know when you want to be in a relationship with someone?",Yamauchi-Tetsuo,AskWomen
"what would you rather have, a cock that's only 5 1/2 but is thick or a 8"" that is thin?",second-ST,AskWomen
Why so many women in a position of power are/look single?,__subroutine__,AskWomen
Hello ladies of Reddit. Recently divorced middle-aged man. What colognes do women prefer these days?,xXUpgraDDeXx,AskWomen
"Women of reddit, do you talk about your sex life in detail with your friends? If you do, why?",Magicdannystar7,AskWomen
When should i call my relationship over?,Grouchy_Extension927,AskWomen
How can I attract someone using social media?,SimElsa,AskWomen
How much as you supposed to feel down there?,Toxilyn,AskWomen
What's your favorite perfume?,NefariouslyHot666,AskWomen
how would you react if a guy friend told you that you were masturbating in his dream?,mossmars,AskWomen
When should I call her?,TheHugeTurtle,AskWomen
women who used to have breast-orgasms. What happened after your kid was born?,Sr_Alniel,AskWomen
What do I do? Lost all of your confidence in your friends bcz one of em cheated on you with your gf and they knew that while she says she has been seduced?,PriceInteresting1173,AskWomen
What do I do?lost all of your confidence in your friends bcz one of em cheated on you with your gf and they knew that while she says she was seduced??,PriceInteresting1173,AskWomen
"Women with few/no friends, how did you handle having a wedding?",bside9,AskWomen
how do I tell my girlfriend I cheated on her once?,ConradTheAstronaut,AskWomen
how do I give this girl a chance after she chose me as her second option?,hairy-sasquatch,AskWomen
What do you think about staying friends after amicableish breakups? Would really appreciate a female perspective on this,Sh00tingMirage,AskWomen
How type sex women like,Secret-Artichoke-725,AskWomen
How do you feel about your most recent ex ?,needabetausaname,AskWomen
What’s a fond memory you have with an old school friend?,watermelonsugar420,AskWomen
Where?,Nudismlover01,AskWomen
where,Nudismlover01,AskWomen
What is your opinion on feminism?..,Professional-Lie-431,AskWomen
"What is the correct way to handle the situation if the other person plays hot and cold/""on and off""?",zaWitcher,AskWomen
Need advice for my sister. She is amd at me because I lied to her few times (for her but she took my action otherwise..details below). What to do now?,pie-chad,AskWomen
why is it not ok for a guy to not climax?,oddbod11,AskWomen
"Petite women who frequently get called cute and sweet, how do you feel about it?",celestialmoons,AskWomen
How do you deal with a man that puts you down for not being like his mother?,In-love-w-dober,AskWomen
why do some of you leave men without any reason?,Useless_Teenager,AskWomen
"how do you feel about guys wearing ""wife beaters""",dextroflipper,AskWomen
why is my period so short?,arson_lies,AskWomen
What makes you Girl ? Read body text.,Quiet_Rip_0809,AskWomen
How does this sound to you? Is this a mental attack from a toxic person?,powderedgiraffe,AskWomen
"My SO says she isn't sure what orgasm is or if she had experienced it, how can I help?",VergDan,AskWomen
What would be your dress of choice if it was the only one you could wear all summer?,4sad2turtle0,AskWomen
what's up?,malaavida,AskWomen
what's up,malaavida,AskWomen
Why is it almost impossible to get an IUD in India?,musgonb,AskWomen
"Say we managed to ""free the nipple,"" would you take advantage of it? Why or why not?",Potential_Hooman812,AskWomen
when is birth control for 12yr old okay?,SquirrelyJazzy,AskWomen
Why only fans?,hoy4356sjsh,AskWomen
Why of,hoy4356sjsh,AskWomen
When did you realise you grew out of your ugly ducking phase? What was your first reaction?,AKKS2010,AskWomen
What drastically changed when you turned 25?,madkidnyv,AskWomen
Where to take gril on a date? (Excluding restaurants and it isn't a first date),eRiC12602,AskWomen
"What are your opinions on ""cut vs uncut""? How do these differences affect your experience?",Kiwi-Fox3,AskWomen
"Where to take girl on a date, excluting restaurants (not a first date)",eRiC12602,AskWomen
"Age 18-22 women, how many relationships have you been in? What is it that you learnt from this experience?",xegan271,AskWomen
"Lesbians who had sex with a man, did you enjoy it ?",nowThatsaName7,AskWomen
Who here feels great showing their boobies online (snapchat)?,Introvertly_TitsyD,AskWomen
"Hi, female teen here. How do I control my sexual desire?",heyhowyehdoing,AskWomen
Do you have any advice for a 25-year-old girl who thinks she just wasted her golden years?,Cminjalili,AskWomen
"Ladies who present a fierce and strong facade (in person and on social media) yet truly soft inside, why do you do it?",number1popcornlover,AskWomen
Have you ghosted someone you dated and regretted it after? What would you do to have the ear of him/her back?,extradaytrader,AskWomen
When is it weird that you care for someone? (am i wrong here?),Yourbigpalal,AskWomen
what are the best fertility trackers? too scared of pressure from family if I ask on social media,vilecreation666,AskWomen
"I (a man) lost my virginity at 28 to an escort, what would that change for you, if anything, in a relationship?",pepitoonreddit,AskWomen
How do you manage your relationship and feelings when you have the feat of losing trauma?,Cminjalili,AskWomen
Ghosted after 9 months ? What should I do? should I text ?,mmmb42020,AskWomen
How does it feels to be the First and oldest daughter?,Accurate-Ad-3474,AskWomen
"Women of Reddit, what do you think of men with acne scars? Is it a deal breaker in dating?",DoyleisAHero,AskWomen
How would you feel if your SO bought you something for sexy time?,Zucster,AskWomen
What’s a sign that someone would give great head?,yelanich,AskWomen
What kind of men give the best head?,yelanich,AskWomen
"If you learned that your SO lost his virginity to an escort in his late 20s, what would that change for you, if anything?",pepitoonreddit,AskWomen
at what age did your parent ask you to move out?,TheTruth221,AskWomen
"Women of Reddit, Your Male FWB introduces you to his male friend. You and male friend vibe hard and have more in common. What do you do?",Remarkable_Doctor_69,AskWomen
Women of Reddit: what would you do if Your Male FWB introduces Male friend. You and Male friend vibe hard and have more in common.,Remarkable_Doctor_69,AskWomen
What is the worst thing you go through during the month?,StunningAd1313,AskWomen
What are the gender expectations concerning women in patriarchal societies?,Curious_Kitty999,AskWomen
"Women who had dark hair and dyed it white, how was the day-to-day care?",DealerZealousideal38,AskWomen
What do you think of men who only work out to get sex?,CutcutcutW,AskWomen
what’s your go-to tv show for when you’re feeling very sad and lonely?,Big_Pirate2229,AskWomen
How would you react if the government wants to conscript you as a Woman in the Military?,OkYak4966,AskWomen
"Ladies, did you ever regret getting engaged, married or dating a specific person? And why?",Mission_Cranberry786,AskWomen
How would you react,OkYak4966,AskWomen
When was the first you experienced sexism? What happened?,Critical-Lemon3545,AskWomen
Would you ever be open again to a friend who has confessed their feelings to you?,throwaway01923ab,AskWomen
How do I shave down there?,Present-Painter3285,AskWomen
How would you feel/react if your bf was into pegging?,IamNotHere1869,AskWomen
"What is your preferred method for watching nsfw stuff? Reddit, twitter or something else?",3TempoSlow,AskWomen
What do you think about the term “birthing people”? Is it degrading to women?,Critical-Lemon3545,AskWomen
How would you classify these gen z years?,Critical-Lemon3545,AskWomen
What is the female equivalent for getting a boner?,SnooDogs2336,AskWomen
Girlfriend says she thinks of nothing when she masturbates??,aligatordog69,AskWomen
"Attractive women - how easy is it for you to make friends? And if you don't have friends or many friends, what are the reasons?",MelancholyBean,AskWomen
My GF says she thinks about nothing when masturbating!,aligatordog69,AskWomen
Which stereotypes are true when it comes to us ladies and sex?,Adviceismymiddlename,AskWomen
What to do about chub rub?,RadiantGuide7,AskWomen
"Ladies, is it a sign to have a baby when everything around is about pregnancy?",Physical-Witness-212,AskWomen
How do I get free karma as a newcomer to reddit? Thanks for the help,Critical-Lemon3545,AskWomen
Why would my body shape change so late in the game?,RioBlue93,AskWomen
Why would my body shape chnage but not my weight?,RioBlue93,AskWomen
How do I response to the lock and key argument?,wabi_sabi_tears,AskWomen
How do I reconcile with the fact that a lot of girl friends I have seem to have initiated over me being attracted to them?,ChillYoshi,AskWomen
"When out in public, do women ""sexually grade"" others in passing?",titanbam1,AskWomen
What do you think about feminism . Would you like it if your partner was a feminist ?,Final-Proposal367,AskWomen
How do you tell if he likes you or if he's just being nice?,MagazineSimple6118,AskWomen
"People who have periods, which organic, disposable pads do you recommend?",FueledByFlan,AskWomen
what's the worst way someone blew the chance of dating you ?,sinhma,AskWomen
What is the most romantic thing ever you imagine or that happened to you?,Final-Proposal367,AskWomen
"How do you feel about making a ""sex tape""?",haze--e,AskWomen
What are your experiences dealing with high class/celebs/powerful people etc?,buzzlightyear77777,AskWomen
What are the bones of your make up?,bouji_baby,AskWomen
Should I 33(F) continue to entertain him 39(M)? How would we talk if we did?,Competitive_Pen989,AskWomen
why you got daddy / mommy issues ?,Pleasant_sunflower_,AskWomen
"I’m a Starbucks barista, what can I get for you today?",_W9NDER_,AskWomen
What is a small thing you’re embarrassed about but other people seems fine with it?,Radiant-CurlyAss,AskWomen
how often do women care/think about nails &amp; terminology?,Bdtyreq12,AskWomen
How do you determine if you are annoying your friends or if it is anxiety?,flowy_n_blowy,AskWomen
How much should I be freaking out?????,asfsxbhgf,AskWomen
It started is a pink spot and now there is a lump… what do I do???,Potentially-booked,AskWomen
What is one thing you and your partner do that you are surprised not all couples do?,Thick-Ass-Chloe,AskWomen
"Genuinely curious, what's the reason for having your cashapp or venmo in your bio if you provide no goods, or services through you media account?",Sea_Definition_7801,AskWomen
How do I not fumble the ball?,skfien,AskWomen
"Piggy backing off a recent post - Daughters of Reddit, what does it feel like to have a mother that loves you?",amiinvisibleyet,AskWomen
Have you ever met your doppelgänger? And how did it go?,Sojilone,AskWomen
I’m so shy when it comes to talking to other females,Blue_Jay725,AskWomen
my buddy said “ a woman’s sex drive is based solely on thier viewpoint of thier partner” what’s the majority opinion on this?,brentt45,AskWomen
How do I make a playlist for my crush?,VenkyMenon,AskWomen
Who knows about Boric Acid capsules for BV?,janes_america,AskWomen
"Would you rather be played by Nicolas Cage or Dwayne Johnson in your biopic, and why?",estpenis,AskWomen
Women of Reddit why is it so hard to decide on what you want to eat???,CheekSlayer662,AskWomen
why..?,Impressive_Ad_4599,AskWomen
women of reddit who are not photogenic…. how do you deal with social media ?,jswervin,AskWomen
When should I go see a gynaecologist? Do I go when I have any problems or can I simply get a checkup?,Altruistic_Peanut_68,AskWomen
I Love Women (That's It That The Post) Also I'm Hungry What Should I Eat?,Altruistic_Peanut_68,AskWomen
How would you feel if you found out your best friend was dating a married man?,Extra_Caregiver9405,AskWomen
Why girls loves big booty men,arnoldlou,AskWomen
How can I be myself around women if myself is something that women don't like? is it better to be myself or just try and change into something else?,Trichomewizard,AskWomen
Why would you flirt to the point of making out on a night out if you were married?,whiskmeoffmyfeet,AskWomen
How do you get over someone you never had?,MagazineSimple6118,AskWomen
How much do you pay for a trip to the hair salon?,lettuceturnipdabeetz,AskWomen
Why is being a boob guy now a red flag?,leekee_bum,AskWomen
What is the bare minimum amount of makeup you will leave the house with?,Liz-Anya720,AskWomen
I'm 24. is it a compliment or insult when people think I'm younger then 18?,pony112,AskWomen
How do you feel about sharing or having an open relationship?,OneBrokeMf,AskWomen
How would you explain women's fashion to a guy in 2 minutes?,mentalfloss3,AskWomen
"Ladies, do you like a man who wears rings?",ieldann,AskWomen
Do yoy need someone else to affirm how you look or dress or self affirmation is sufficient?,svotso,AskWomen
Do you need someone else to affirm how you look or self affirmation is sufficient,svotso,AskWomen
"Hello, recently divorced middle-aged man. what are some popular colognes women prefer these days?",xXUpgraDDeXx,AskWomen
"What are those little moments in life with your significant other that make you think: ""Yeah, they definitely love me."" ?",TheAgingFlame,AskWomen
who is the woman equivalent to keanu reeves?,Silly-XboxGamerTag,AskWomen
When did life actually become enjoyable for you?,Radiant_Pay7187,AskWomen
I have a question for you ladies about how it seems my wife has little regards about our relationship and myself can you please tell me what you ladies think?,Consistent-Way-795,AskWomen
I have a question for you ladies it’s about how my wife seems to have little regard for our relationship or it seem like it to me so here’s what happened,Consistent-Way-795,AskWomen
"Girls from reddit, did you ever regret dumping a nice guy? Why?",Dry_Championship_200,AskWomen
High School Certificate Requirement Where I Complete My Personal Interest Project,tappsarah,AskWomen
Who would override a guy’s clingyness behavior if he was physically attractive?,According_Leek3119,AskWomen
"Women, how do you feel about yourself? If so, why?",mrs_undeadtomato,AskWomen
How would you feel about an open relationship?,OneBrokeMf,AskWomen
"34 Virgin [F], What to expect in my first time?",Palestinianforever,AskWomen
"Women of Reddit, what are your little moments in life with your significant other that make you think: ""Yeah, he definitely loves me."" ?",TheAgingFlame,AskWomen
What is one type of people (especially women) that you can’t stand?,nwhq,AskWomen
Why would my adopted brother have more sexual/romantic encounters than me considering these things?,Livid-Guava2779,AskWomen
where there any royal women/girl that pretended to be a prince?,_anxious_squirrel,AskWomen
what mistakes if any did you do for a good guy/girl to run away from the relationship?,Silly-XboxGamerTag,AskWomen
Self esteem. How do you feel now versus teenage years. Is your confidence better or worse. And do you feel social media makes it worse.,Spirited_Ad2202,AskWomen
"If you could go back in time and tell 18 year old you something, what would it be?",Sparklybitchhh,AskWomen
How can I get rid of my toxic masculinity?,yaisame,AskWomen
Have you ever been an as*hole to a nice/good guy ? and why if you did ?,Silly-XboxGamerTag,AskWomen
What advice would you give to your 18 year old self?,Sparklybitchhh,AskWomen
Hello girls of reddit. I just wanted to know what makes them lose interest in a boy.?,New_Classroom2701,AskWomen
How do I (M) deal with losing a friend (F) through a mutual agreement?,GoofinNoCap,AskWomen
At what age did you truly begin to enjoy life?,Life-Disaster-8384,AskWomen
How much detail do you go into when talking about a sexual experience/ partner to a friend?,Apeeeu_,AskWomen
Has anyone given a man an oral yeast infection who went down on you?,painful_pisser,AskWomen
"Girls, people with cycles, When do you get emotional: during your period (as the cliché) or before?",diggingmyowntomb,AskWomen
"Women of reddit, how would you react to your partner suggesting the use of sex toys on themselves during sex?",noidkwhatsgoingon,AskWomen
How do you ask roomate if they snore?,sxmOnYu,AskWomen
Women of redit: what is your go-to response when a man calls you fat?,BoredAnimeWatcher,AskWomen
How has your home decorating style changed over the years?,sunfloweries,AskWomen
How do you manage Mother’s Day when it’s hard?,Bog_vvitch,AskWomen
How did you know marriage was for you after not wanting it initially?,Enough-Tackle8043,AskWomen
How do I balance being emotionally vulnerable whilst not becoming a burden?,TheAgingFlame,AskWomen
What are good underwear brands?,jasinoke,AskWomen
What is a question you wish someone would ask you?,BrucePennyworth,AskWomen
What are some tips of advice for a woman starting the journey of getting through past trauma?,CommitteeUnhappy6821,AskWomen
Ladies of Reddit: How do you think the first date went?,Stunning_Culture_560,AskWomen
Which rose toy brand is the best?,Fine-Collection-1498,AskWomen
How would you host a house meeting,Rough-Cucumber2263,AskWomen
Do you ever feel like you're just minicking social gestures and how do you cope with it?,ceara-dee,AskWomen
What are signs you show when interested in a man? Outside of flirting,AmazinglyOdd81,AskWomen
"Women, how do you celebrate Birthing Person's Day? How is your birthing person special to you?",Keypeeleenjoyer,AskWomen
How does this look as an DM approach to a woman?,albish,AskWomen
How can I start selling feet pictures?,ZestycloseTea9301,AskWomen
"Fellow women of Reddit, what were your experiences of the best orgasms you’ve had?",BabyPluto_16,AskWomen
why as a tall thinish woman is is so difficult to find a shirt that fits my torso in a comfortable and flattering way but is also long enough that goes completely past the waistband of my pants?,PertinentNoodle,AskWomen
What's the best way to build a solid community of supportive women?,flawsyone,AskWomen
What was something you have learned about human nature as you have gotten older?,shockedpikachu123,AskWomen
"You're delivering pizza and a Gorilla wearing a varsity jackets answers the door. You tell them the price of the pizza and they nod and hand you the exact amount plus a two dollar tip, what do you do next?",Babybeans619,AskWomen
"What does it mean when I reached for a handshake, and got a pull for a hug?",Mefx97,AskWomen
How would you feel about the patriarchy being replaced by a matriarchy?,GrumpyYusufIslam,AskWomen
"Women of Reddit, Why do some women stay in a narcissistic relationship?",Sgedianho,AskWomen
Women of Reddit. How weird is it to approach a girl on the subway?,FrostVIINavi,AskWomen
Why does licking a vagina gives pleasure?,BabyPluto_16,AskWomen
for women : Does the dik color and shape matter ? if yes .. tell why,Professional-War8825,AskWomen
What’s your opinion,Electrical-Dream-550,AskWomen
"How would you feel if your sister, the cool and trusted aunt, went out of her way to purchased your teenage daughter an emergency birth control pill and kept it a secret from you?",MyCatCereal,AskWomen
How do you feel about men calling you their princess?,shellusaur,AskWomen
How to make samll talk with an introvert girl as an introvert?,TheGameCh4nger,AskWomen
"i confessed to so someone who i like and said that she would give me a chance,should i say good morning everyday",Master_Tourist_323,AskWomen
What does she mean when she says it isnt serious?,sandisk8gig,AskWomen
How to manage sex: Advice and Education on Oral Sex and Sex in general,Puffed-Marshmallow21,AskWomen
What’s the clumsiest thing you’ve done on a date?,No-News2day11,AskWomen
"In your opinion, do you think women belong on the battlefield ? and why ?",Silly-XboxGamerTag,AskWomen
Why do I feel so empty after my bf broke up with me even though it was ‘mutual’?,One-Ranger-7780,AskWomen
Why wont my ex girlfriend look me in the eyes?,Tough_Drummer_3205,AskWomen
Why wont my ex gf look me in the eyes,UniformOcean760,AskWomen
Why do I feel so empty after a breakup by ex bf instigated that was ‘mutual’.,One-Ranger-7780,AskWomen
Why does my lady area burn after sex?,Diver_Fuzzy,AskWomen
How would you introduce your daughter into her growing body? Any tips?,Xoria317,AskWomen
My wife has been mistaken for our toddler's grandma a few times and it makes her feel awful. How can I comfort her about that?,ChadTeddyRoosevelt,AskWomen
"To the women that randomly ghost people once a month for a week, why?",yourmum69L,AskWomen
"No idea what’s going on but, I think I find women attractive, especially if they’re my bf’s type because I like imagining him having sec with them while I watch",Lucky_Water4924,AskWomen
How to stop being used for sex?,yayayayayayagirl,AskWomen
who is willing to talk to me for a bit?,super_kitten2022,AskWomen
How to stop being used for sex,yayayayayayagirl,AskWomen
How long where u with ur SO before u said I love u,Chl-cul,AskWomen
"Male growing his hair out here, where am I going wrong?",MGH-Head,AskWomen
"Male, here, who is growing their hair out…..",MGH-Head,AskWomen
why would you reply a someone late?,Ok_Specific_3412,AskWomen
Who do most of the women reply late?,Ok_Specific_3412,AskWomen
how do you get cleavage?,snakecycle,AskWomen
What things make you swipe left or right on dating profiles?,Pineapple_WarpDrive,AskWomen
What are your goals?,dontkno1122,AskWomen
"Women of Reddit, what’s the equivalent of lingerie for a man?",Easy-Necessary-4755,AskWomen
why do i feel conflicted?,dic2big,AskWomen
how do you get wider hips??,saucyasiam,AskWomen
How should I handle my SO demanding me to be on the pill?,ShortNSilky,AskWomen
How to handle this situation?,Merhci-nu,AskWomen
What is the hottest thing a lover can say in bed?,Mohameddali,AskWomen
what’s your take on unplugged ceremonies?,WelcomeToAshleyTown,AskWomen
What was the worst argument you and your SO ever had?,Cierradical,AskWomen
What picks you up when you are down?,nana_33,AskWomen
what do you do with a vibrator?,Mohameddali,AskWomen
How do I stop my period?,G_G-1_1,AskWomen
How did you recover from feeling rejected by your dad as a child/teen because of panic attacks?,shawtyb6,AskWomen
what are the places where i can meet women?,InternationalSir2546,AskWomen
how can i approach her,AmgVrs,AskWomen
"Woman of Reddit, what your thoughts on chest/back hair?",No_Engineer1470,AskWomen
Has Anyone Had Fybrostic Breast Disease Which Caused Symptoms in Only One Breast?,Tough-Chocolate4124,AskWomen
Women with a kid from a man with multiple other kids from several different mothers. How does it feel?,AI_38Baby,AskWomen
"Women of Reddit, would you consider sharing knowledge with your partner a love language? A part of which love language would that be?",Easy-Necessary-4755,AskWomen
what is your opinion of socially awkward guys?,Ok_Hat_8157,AskWomen
"Can friendships of three work? If so, how? If not, why not?",violet_mm,AskWomen
What is your favourite way to spend time in bed? What is your least favourite activity in bed?,Mohameddali,AskWomen
What is a good self-tanner?,MandamandaOkc,AskWomen
"Ladies, what do you think of men who haven’t ever been in a long term relationship?",frxgmnts,AskWomen
what do you enjoy doing for fun?,Mohameddali,AskWomen
Ladies what is your 5 year plan?,Excellent_Coach3209,AskWomen
