title,author,subreddit
What kind of forearms do women like?,Tough_Solution_2305,AskWomen
What kind of forearms do women like,Tough_Solution_2305,AskWomen
When women say they really like abs?,Tough_Solution_2305,AskWomen
Which are subreddit allow woman can be truly represented ?,Anicoman,AskWomen
What are your honest thoughts on women you envy regarding their appearance?,tired_happy_expired,AskWomen
Who feels like the mods are way too restrictive on what can be discussed here?,Ok-Statement-2,AskWomen
"What symptom of your period do you have every single month, without fail?",sverdech808,AskWomen
"Women who have been cheated on, what did you do to regain your confidence and/or self-esteem?",Significant_Ad_4381,AskWomen
What would you wear on a (second) date to go paddle boarding followed by dinner (steakhouse)?,MysticalJoy,AskWomen
"Ladies, what is something your insecure about?",mangopeach2,AskWomen
"if your single friend wanted to set you up with a guy, what factors would determine whether or not you would meet him?",No_Supermarket7771,AskWomen
What are the benefits of being single?,letmeseeutootsieroll,AskWomen
Who gets their period every time they miss one day of birth control?,Ill-Bite-6864,AskWomen
What is “popping your Cherry” like?,Slurpin_Spaghetti_22,AskWomen
"Women of Reddit, when you say “I’m not looking for a relationship right now”, does it mean “I dont like you” or does it mean that you aren’t looking for something like that right now, but maybe in the future?",Adv1c3Account,AskWomen
What is the safest methode for walking alone late night?,WWWHHMMM,AskWomen
who here thinks that a long distance relationship is possible for a few years?,frenchforliberty,AskWomen
"why am I bothered that my bf follows and likes the posts of half naked women on social media? the kind with fake breasts, Botox faces, no clothes and back wrenching poses.. a lot of them have only fans accounts they advertise for.. why does it hurt my ego?",sassibee,AskWomen
neibour fingers herself extremely loudly what should I do(please help),Potential-Sale4482,AskWomen
"Ladies, would you date an ugly janitor and if so why?",AmbitionLazy,AskWomen
When a man yells in your face what runs through your mind?,Ok-Statement-2,AskWomen
"When a guy gets in your face, yelling is it unreasonable to think that he’s going to hit you?",Ok-Statement-2,AskWomen
can i use boric acid if i’m a virgin and if so where do i stick it up at?,pigeonEater111,AskWomen
Why do some women find Veins attractive?,DogeWelder,AskWomen
What time do you start to (if at all) feel unsafe walking on the streets?,Cold-Mortgage8100,AskWomen
Friends who copy what you do,UneFemmeALaPeauBleue,AskWomen
How should i know that the one i love loves me back? Is this one sided?,Desipinkmam,AskWomen
"Women of Reddit, when is it appropriate to send a first text?",kazsvk,AskWomen
How do you feel about Elon Musk buying Twitter?,IceCreamAndMilkshake,AskWomen
"Chia Seeds... I have been eating them every morning in yogurt and have noticed some interesting side effects. Let's just say the hubs is not complaining, i think it has something to do with the benefits of omega 3. Anyone who eats chia seeds regularly, have you noticed any specific benefits?",BeautifulAromatic768,AskWomen
What should I do to not be tired all the time?,Macbethdied,AskWomen
How to help my girlfriend with Depression and Weight Gain,Key_Middle3800,AskWomen
How does personal boundaries affect your relationship?,MjoloNews,AskWomen
I cheated on my girlfriend with my ex-girlfriend around 3 years . Now I realize how much I loved my girlfriend beside my arrogance and anxious attachment problems . İs there any chance for her to forgive me ? What can I do ?,thealph4isagod,AskWomen
"Those whose parent has/have been diagnosed with a serious illness, do you have any advice on how to deal with that news?",sara_or_stevie,AskWomen
Are you going to continue using Twitter now that Elon Musk bought it? Why or why not?,mari_gaby,AskWomen
"Ladies, how many times have you been the “crazy girl” ? And what happened?",_triste,AskWomen
"Seriously, what are you supposed to say right after sex?",Disboixxx,AskWomen
To all women engineers :) How is it like being a woman in the engineering field?,coolmysticalbeing,AskWomen
What am I doing wrong… Help a self-tanner newbie?,Solcean,AskWomen
"Those with fish tanks, what kind of aquatic life forms do you have?",agentbanana667,AskWomen
Do you think that most people can ever find the perfect spouse and why?,ilpcbf1524,AskWomen
"What’s your favorite thing about yourself, physically?",Balanceblu,AskWomen
"How to stop overthinking about a problem, when all you can do is wait for more information? Calm down and keep the anxiety low enough to function",Acceptable-Ad-880,AskWomen
"Worst Period Cramps, what to do?",Akito_Stan,AskWomen
What is a replacement for jeans?,MirafuCh,AskWomen
What are you currently dreading?,dxadr0sx,AskWomen
How did you become more comfortable walking outside alone as a woman?,sanitychaos,AskWomen
How? I need opinions,Jellyhead1,AskWomen
Women of Reddit: What are the telltale signs that you are actually orgasming versus just faking it?,triviumfan4ever93,AskWomen
How do you become more comfortable walking outside alone as a woman (day or night)? Is there any way to get rid of the paranoia and feeling of unease?,sanitychaos,AskWomen
how do you get orgasms?,imguiltyiknoww,AskWomen
What Do You think?,cree8vision,AskWomen
I don't know how to orgasm,imguiltyiknoww,AskWomen
How do I softly reject a guy from a tinder date/meeting that I don't have interest in?,BOOMAMUS,AskWomen
What makes relationship sex better than single sex?,PartyFoundation5821,AskWomen
Think about your worst break up. Do you still think about them sometimes? Why?,Forever_5998,AskWomen
"I think my partner is more of a friend than a lover, what should I do?",[deleted],AskWomen
what do women think of society as a weapon? (against women and men aswell),pcgamer3000,AskWomen
"girlfriend killed partner, what could of the guy done differently?",syhshsusis,AskWomen
What gives you the most confidence?,[deleted],AskWomen
"When a man shows interest in your feelings, do you perceive him as undesirable or unmanly?",2gingerkings,AskWomen
"On a scale of 1-10, how well do you communicate with your partner?",[deleted],AskWomen
"What's a good response to ""You probably get that all the time"" when a man gives you a compliment? Or, ""Lots of men on this app are probably telling you that""?",hello_myusername,AskWomen
"What's a good response to ""You probably get that all the time"" when a man gives you a compliment?",hello_myusername,AskWomen
What Do You Do If?,cree8vision,AskWomen
I have a thing for a man 30 years older than me.. what should I know before sleeping with him?,[deleted],AskWomen
"There are airbnb listings, in which host and guest sleep together in a room. How would you deal with nudity in such a context?",[deleted],AskWomen
How would you feel about a man being uncircumcised?,Apprehensive-Shoe967,AskWomen
What To Do If...,[deleted],AskWomen
How would your 10-year-old self react to what you do now?,Automatic-Lie-4223,AskWomen
How do you know when someone’s projecting their insecurities onto you?,Extra_Caregiver9405,AskWomen
When my date ate my poop on accident,EveningLiterature385,AskWomen
"Plus size ladies, what are you best tips for going on holiday to somewhere hot?",Elmoaiii,AskWomen
How many heartbreaks did it take before you found your forever person?,No_Effective_7592,AskWomen
Why not? I want to win a condom contest. I just need your like on instagram to help me 😊.,Jeanlucpaulokay,AskWomen
"Why do a lot of women love popping their partners zits, cysts and boils?",mojomojomojo50,AskWomen
Quite the question here : How would you give yourselves ( as a couple ) the best chance to make a long distance relationship work?,[deleted],AskWomen
What do you want to see in a guys bedroom?,Mean-Technology7659,AskWomen
What is the best way to make your ex girlfriend regret cheating on you and miss you badly?,No-Original-9833,AskWomen
What is the best way to make your ex gf regret cheating on you,[deleted],AskWomen
What do you want to see in a guys room,Mean-Technology7659,AskWomen
Where can I buy a prom dress?,[deleted],AskWomen
what to do ?,[deleted],AskWomen
"What is a hidden gem that found on accident ,but ended up loving it?",kibrand,AskWomen
Where can I find older women to date in India?,_GrowGreat_,AskWomen
what should be done in this case ?,Impressive_Wrap_7954,AskWomen
what are the subreddits where i can post my photos and know how my body looks in a boys perspective( not naked photos fully dressed)?,[deleted],AskWomen
Why do some women say their not hungry but steals their SO's food anyways?,[deleted],AskWomen
what can i do,Impressive_Wrap_7954,AskWomen
How are muscular men actually more attractive or is that just a social stereotype?,EmergingAnger,AskWomen
Why do some women say their not hungry and steal their SO's food anyways?,[deleted],AskWomen
what to do,Impressive_Wrap_7954,AskWomen
What Do You Do If...,[deleted],AskWomen
"if anyone has any questions about relationships i can help, ask me what ever you want",therealharleyquinn1,AskWomen
What is your most controversial opinion?,Thick-Ass-Chloe,AskWomen
"I genuinely asked a girl on TikTok to go for coffee and talk about cinema, she said yes, and now I'm not sure how to best handle it cause I have social anxiety. What is a proper next step?",0611547894556456,AskWomen
"Why do a lot of women act like men don’t, or shouldn’t have emotions?",Prestigious_Most_797,AskWomen
"Women, why do you try hypnosis?",ShaiLight2,AskWomen
"I genuinely asked a girl on TikTok to go for coffee and talk about cinema, she said yes, and now I'm not sure how to best handle it cause I have social anxiety and really like them as a person",0611547894556456,AskWomen
How does the male-centric dialog around the Depp/Heard case make women feel?,SmakeTalk,AskWomen
how can you respectfully ask a lady for her age?,[deleted],AskWomen
Why: Help me make online dating more fun and safe,charlied044,AskWomen
Is it true that your experience from the first time sex will affect on your sex life? Please explain why it's true or false.,-homosapiens,AskWomen
Have you dated someone “out of your league”? How did it effect you?,[deleted],AskWomen
"To women who have been in toxic/abusive relationships, did it ever get better and if so, how?",[deleted],AskWomen
I find it upsetting when my gf hangs out with this guy. What should I do?,[deleted],AskWomen
Why does my BO smell good to me?,[deleted],AskWomen
I find it upsetting when my gf hangs out with this guy.,[deleted],AskWomen
What is the worst wardrobe-related injury/malfunction you have endured?,KeyProperty2134,AskWomen
Why are women ashamed to admit they watch porn ?,[deleted],AskWomen
What's your phone number? mine's is 52+(662)3383-823,ricomoralesluis,AskWomen
A person your age writes you a ✉️✉️💌 and it shows how much he will miss you and how emotionally attached he is rather than physically. Wyd?,[deleted],AskWomen
Serious question… How would you react and feel if a man gets emotionally attached to you (doesn’t care about physical body) and admits it through any sort of paper writing.,[deleted],AskWomen
"Ladies who have dealt with domestic violence, how did you move forward in terms of dating?",queen-ofthe-clouds,AskWomen
what age has done to you other than getting older?,6elixircommon,AskWomen
How likely is it for a platonic friendship to turn into a romantic/sexual one? Has you ever grew to have feelings for a guy friend?,Cokecarti,AskWomen
What’s your preferred method of birth control and why?,Ok-Statement-2,AskWomen
How would you feel if a person got emotionally attached to you because he likes your insides rather than anything physical?,kixaneer,AskWomen
What are signs that a man is slow fading you?,spodaat,AskWomen
Dear Women! What would you seriously feel if a genuine person fell in love with you emotionally over your inside stuff rather than your body?,[deleted],AskWomen
What to do about Pap smear anxiety?,scaredytaxx,AskWomen
What would you do if a genuine person got emotionally attached to you and always compliments your inside rather than your body?,kixaneer,AskWomen
How many years will it be between the time the first human is born from the artificial womb to the time the last woman is born?,kirsemenov,AskWomen
What would you do if a man’s 💌 to you seemed to be emotionally attached rather than physical compliments?,kixaneer,AskWomen
"Anyone from single-parent or single-caregiver families, how do you think it affected your early s***** experiences as a teenager? (Before 15 years old)",ADancingSim7,AskWomen
What is going on with this girl that told me she is falling in love with me but keeps finding excuses not to take me to her place?,TX_HandCannon,AskWomen
how do you tell if someone is NOT a nice person?,NoCommission835,AskWomen
More positive questions! What’s your fav dumb/needy thing to do with your friends?,Expensive_Trouble,AskWomen
How do you make friends with other women?,flowwolfflowwolf,AskWomen
Why can't I believe this girl who told me I made her finish 7 times?,RutabagaReasonable,AskWomen
Why could this be?,yoloo2022,AskWomen
What are your thoughts??,Massive-Actuator8732,AskWomen
"how can i make a woman feel more confident about herself (body, personality, hobby, future)",Remote_Nobody7582,AskWomen
Who has had a miscarriage?,myepsteinera,AskWomen
How would you feel if the man you loved wanted to have children through a surrogacy because he didn’t want his children to have your genetics.,LaxLoner,AskWomen
"What would you do if you realize classmate you talk to, has a crush on you? How will you deal with it?",kixaneer,AskWomen
Do females really get impressed when their partners get into fights? Do they prefer their male partners to avoid fights and solve problems peacefully??,FutureTrili,AskWomen
Curly-haired gals - what are you sick of hearing?,BubbleWrapWaffle,AskWomen
What are the biggest differences between men and women in a relationship?,exquisiteesquite,AskWomen
"Ladies who broke up with a perfectly good partner in order to be with ""the One"", how did it go?",throwcuzimlonelyaf,AskWomen
Which one is it?,Due-Power1113,AskWomen
"what female figures in books/movies/stories did you hate as a child, but now appreciate, understand, or admire?",hyena_smile,AskWomen
What would you seriously do if a classmate of yours has a little obsession on you?,kixaneer,AskWomen
Why do you regret retiring?,1xbittn2xshy,AskWomen
What would you do if a classmate of yours has an obsession about you but it’s kept secret?,kixaneer,AskWomen
"Gals, What would you seriously feel if your classmate has a secret obsession on you?",kixaneer,AskWomen
"What is your opinion on the nature of the show ""South Park"" and its jokes?",ScummyMan12,AskWomen
How often should I get a facial?,jstmehr4u3,AskWomen
What’s the worst thing your girl best friend has done which she told you about?,kixaneer,AskWomen
How old were you when you first hooked up or gone with a fling?,kixaneer,AskWomen
why,hamdy_m_said,AskWomen
"Women, how comfortable are you going out in public without a bra on?",A-Shy-Smile,AskWomen
What happened to you in your real life that could’ve been directly read from a romance novel?,mbow123,AskWomen
What skilled trade do you work in? what's it like?,FacetiousMoi,AskWomen
Do you get jealous when your bf talks yo any other girl?,_aj1,AskWomen
What is going on with this girl that told me she is falling in love with me but keeps finding excuses not to take me to her place.,TX_HandCannon,AskWomen
How do you take care of your hair?,ASA_lessaAisa,AskWomen
"women of reddit, how do you handle painful periods?",harriet_xo,AskWomen
how to contact my ex after a two weeks breakup? (M20 F25),climent1,AskWomen
Caught a client's employee who was sniffing his female co-workers chair. Report or...?,dannyphantomsthermos,AskWomen
What do I do?,shrinkusdunkos,AskWomen
How did your sexuality change after stopping hormonal birth control?,inluvw_me,AskWomen
What's your best hair care advice?,ASA_lessaAisa,AskWomen
What has made you ever look back on a time you severely broke a male’s young heart?,kixaneer,AskWomen
"Women, how do you keep up with all the pressure coming from social media?",Clar345,AskWomen
"Mothers of not-America, where are you and what are some challenges to raising kids in your home that you might not have elsewhere?",76qZOdo5nJh502lf,AskWomen
What is your ideal 3 course meal?,SirCumster9000,AskWomen
Would you date a man who is attracted to all genders?,Alt_with-an_alt,AskWomen
Why did you break up from a healthy relationship,GOTIT_CoFounder,AskWomen
How do you get over your SO being unmotivated to do much when you’re significantly more successful?,Rough_Butterscotch37,AskWomen
How would you feel if a guy gave you a 💌?,kixaneer,AskWomen
"Not personal advice but what would you women seriously do if a male person the same age as you that you like talking to, all of a sudden gives you a ✉️💌????",kixaneer,AskWomen
Not personal advice but what would you do if a guy your age you like gives you a ✉️✉️ with his feelings and appreciation towards having you?,[deleted],AskWomen
What do you do with the cell phone cases for your old phones?,dilettantedebrah,AskWomen
Why do I get attached too easily?,Indecisive_complain,AskWomen
Why do I get attached too easily,Indecisive_complain,AskWomen
What are your results on the six triangles test?,Afraid-Requirement70,AskWomen
"Do you have a job that you actually enjoy? If so, what is it?",happiehippie3,AskWomen
How do you stop yourself from buying too much?,Milllott,AskWomen
Too much negative in the world. What’s your favorite thing about being an adult?,Expensive_Trouble,AskWomen
"To women who went through break up, is blocking your ex helped to get over him or keep him and ingnore his existence?",nessareckyloin,AskWomen
"Women of Reddit, when was the last time that you genuinely wanted to help someone and it backfired on you?",Sudden_Necessary_924,AskWomen
What are the things that make this world sometimes or often seem absurd to you?,Realistic_Pirate_422,AskWomen
What is the best vaginal lubrication you would recommend?,EclipzHorizn,AskWomen
How do you cleanup after sex?,summerfridaze,AskWomen
"what is the female equivalent of ""attaboy, sailor"" giving a man confidence",Hinitoo,AskWomen
what are some skin care tips?,AnonymousEngineer21,AskWomen
how to return to my ex after a two weeks breakup? (M20 F25),climent1,AskWomen
What would you tell your younger self?,Nearby_Chocolate197,AskWomen
When was the first time you were eaten out? How was it? And now looking back on it was it better or worse than other experiences you’ve had?,Amphibian-Shot,AskWomen
how to return to my ex (M20 F25),climent1,AskWomen
"For those that have miscarried, how long did you wait to try again? How long did it take to conceive again?",MissesMiyagii,AskWomen
how to return to my ex (M20) (F25),climent1,AskWomen
"[NSFW] Women, do you like when your SO touches and/or kisses your boobs when you are getting down and dirty?",Free_Acadia5975,AskWomen
How are women even single with all the guys throwing themselves at you specially on dating apps? Y’all got like 100s if not 1000s of options?,Fresh-Beginning6597,AskWomen
What sort of things are considered normal in friendship containing a group of women ?Are snide remarks done out of jealousy or portrayed as jealousy ok?,East-Nobody8592,AskWomen
What did you wanted to be growing up? And what you ended to be right now?,Komirade666,AskWomen
why do girls twerk on each other,No_Net_1092,AskWomen
Why am I being nervous? Advice needed please!,Louisa2011,AskWomen
"Which was do you choose to control your period on birth control, if at all?",thunderkoka,AskWomen
"What if you were trapped in Russian occupied territories in Ukraine and were about to be captured, do you let yourself get captured or go out in a blaze of glory?",EPIC_FAIL_73,AskWomen
In your opinion what is the biggest barrier to gender equality presently?,Muslim-Aussie5793,AskWomen
In your opinion what is the biggest barrier to gender equality currently,Muslim-Aussie5793,AskWomen
"How can you best go about changing your birth control schedule, in order to choose when you have your period?",thunderkoka,AskWomen
How do you use birth control to delay your period?,thunderkoka,AskWomen
"#nsfw women of reddit, what in your opinion is the male equivalent of a summer dress to get railed in?",bostonjdog,AskWomen
What are signs you look for to avoid predatory men?,jfkmay,AskWomen
"How to use birth control to manipulate my period, if at all?",thunderkoka,AskWomen
"If you broke up with a partner and then later regretted your decision, how did you handle it?",artjazzandsoul,AskWomen
I just don’t know what to do,Strange-Combination2,AskWomen
What are your thoughts on shemale pornography and the men attracted to them? If you don’t like it when men are attracted to transsexual pornography why not?,estianna,AskWomen
"Thoughts on why radical females exist in far lesser numbers compared to radical men? I’m not just talking about terrorist, political and/or ideological fighters but just in general",estianna,AskWomen
I need help with the girl I love!!!! what do I do??,f_l__,AskWomen
how to say no to people that aren’t mean to you? (this post doesn’t really make sense i’m sorry),just2askiguess,AskWomen
Do secure strong women regret losing a guy and How?,EverthingGuy,AskWomen
What’s some things that you shouldn’t joke about with women?,Round_Percentage_578,AskWomen
How to start/keep conversation going for dating?,Round_Percentage_578,AskWomen
Caught my fiancé watching porn when I was busy planning our wedding,randomnumbers8764,AskWomen
"Ladies, is Jimmy McGill (Saul Goodman) who is from the hit TV series Breaking Bad and Better call Saul, in your opinion hot?",georgethenormal9,AskWomen
"Ladies, is Jimmy McGill (Saul Goodman) who is from the hit TV series Breaking Bad and Better call Saul, in your opinion attractive?",georgethenormal9,AskWomen
How to get a women’s attention,Round_Percentage_578,AskWomen
how to make a text that i wrote into a clickable link?,Intelligent_Run8365,AskWomen
Did it hurt when you lost your virginity?,idkwhattoputreee,AskWomen
"Have you ever regretted wearing a specific outfit? What was it, the occasion and why?",oversizedsweetpotato,AskWomen
What are you most insecure about?,thatcoolguy98,AskWomen
What are the sexiest clothes a guy can wear?,yoitsappy,AskWomen
Online dating for a 46 year old widower who is re-entering the dating world after 20 years,T400,AskWomen
How normal is it not be interested in romantic relationships at 18?,jennierock,AskWomen
"Ladies of reddit, what do you find so attractive about long curly hair on men?",Sheep_Herder42,AskWomen
How long does it take you to get over a breakup,sun-in-french,AskWomen
"What are the meaning of these phrases "" law only flavor women"" and ""equality is when it's convenient"" ?",somethingverylazy,AskWomen
Why can’t I make friends,SpicyE20,AskWomen
"Ladies, why do you love long curly hair on men?",Sheep_Herder42,AskWomen
What moment in life did you realize you are proud to be a women?,thatcoolguy98,AskWomen
"Why so many American keep on using these phrases "" law only flavor women"" and ""equality is when it's convenient"" ?",somethingverylazy,AskWomen
"Why women are ""looking for friends"" on a dating app?",AdministrationFun626,AskWomen
Who can help me?,Shamus_The,AskWomen
How do you feel about women not socially being accepted for being sexually active?,thatcoolguy98,AskWomen
How do you feel about women not socially being accepted to have a horny side?,thatcoolguy98,AskWomen
"How would teenage you (15/16) feel if on the last day of school, a male your age you were talking to gave you a ✉️ filled how much he appreciated you being in his life alongside some beautiful adjectives about you and your persona?",kixaneer,AskWomen
I found a video of my SO doing the deed with another woman. what should I do?,anxtyy_indo,AskWomen
How would teenage you (15/16) feel if on the last day of high school a boy you were talking to gave you an envelope ✉️ filled with how much he appreciated your company and lots of compliments about you?,[deleted],AskWomen
How would teenage you (15/16) feel if on the last day of high school a boy you were talking to gave you a love letter filled with how much he appreciated your company and lots of compliments about you?,[deleted],AskWomen
How can I rekindle I strong drive I once had?,01Vibe-MasterZz,AskWomen
How do you even understand a woman?,xHypq,AskWomen
Why have we seen a rise of extremely young women (18-24) dating much older men?,randomtallblackguy1,AskWomen
What do you hide from men so you don’t get rejected? Saw this in the ask men subreddit so was curious what women’s answers are,Lily8567,AskWomen
What should I do?,anxtyy_indo,AskWomen
What's something you don't actually need but really want?,Cutiebeautypie,AskWomen
What is something that can make sex something so magical?,thatcoolguy98,AskWomen
What compliment are you sick of hearing?,hipnosister,AskWomen
how can i explain it to her - My GF doesn't know my real name,Halvorsey,AskWomen
What is your favourite chocolate bar or sweet treat?,BubbleWrapWaffle,AskWomen
"How do women ""make or break"" a man?",WeeklyAstronaut1700,AskWomen
My daughter's friend got kicked out of prom because of her dress... What do you all think?,throwawaydad2885,AskWomen
Why does the US consume so much “famous people” culture? Why do we place so much societal value on Hollywood/Sports people?,iammagicbutimnormal,AskWomen
how should i feel,avoidingmia,AskWomen
"How would you think about it if a 22 year old dated a 19 year old, or would you think it is weird?",Mongoose_Flaky,AskWomen
