title,author,subreddit
Why do you think there are sexist connotations around the 'male mental health' movement?,Masculive,AskWomen
"I am looking for individuals who identify as Women to comment on the sexist connotations around the 'male mental health' movement. Please contact me for a link to a quick survey if you can spare a moment of your time, thank you.",Masculive,AskWomen
My (M17) GF(F15) has problems with her parents and has su*ci*al thoughts. What can I do to help her?,LMLY2,AskWomen
Why does it hurt so much when the father of your child doesn’t want to be with you?,ThrowRA_workingmum,AskWomen
What would you think if a 19 year old girl was dating a 22 year old guy?,throwaway10283847,AskWomen
when is cheating acceptable?,bedframe17,AskWomen
what is the best “time of the month” hacks and tips?,bedframe17,AskWomen
How often woman make the first move/ ask a man out?,cenzala,AskWomen
What are ideas for a surprise?,Channeltrees,AskWomen
What are some ideas for a surprise!!,Channeltrees,AskWomen
What is a piece of advice for someone starting a new job?,ohlittlebugger,AskWomen
"Married women, how long do you spend on your computer per day for work and social sites?",Unique-Presence-9634,AskWomen
Who can give detailed opinions?,Mindless_Ad_2489,AskWomen
What to do about possessive partner?,Unlovedlol__,AskWomen
"How many beautiful ladies would like to give their detailed opinion on my Stick? Would love to know if I happen to get you wet , dm or comment on profile pics , cum on if you want more ?",Mindless_Ad_2489,AskWomen
"Women of Reddit, for those of you who do appreciate nudes from your partners; what makes a good nude or lewd even?",ParmesanPepper,AskWomen
"How would you describe my Stick, honest opinions ! Dm or feel free to comment On my profile.",Mindless_Ad_2489,AskWomen
What is the obsession with Harry Styles?,maxreddit0609,AskWomen
How would you comfort/say to a friend that has gone through a traumatic breakup?,Natt_Katt02,AskWomen
what is your honest detailed opinion? dm me or comment on my pictures. Get you wet? A+ I have plenty more . I'll be waiting. Cum on beautiful ladies,Mindless_Ad_2489,AskWomen
What is the biggest lie you have ever told?,LotusLilli05,AskWomen
Who’s in the wrong/ what should I do,Medium-Class-3649,AskWomen
I just got ghosted by the guy I lost my virginity to. I’m so attached already and am so depressed. How do I get over him?,meep___beep,AskWomen
what changed when you had a glow up?,snail_admirer,AskWomen
What type of emotional guy would scare you off?,thisuger,AskWomen
"My GF is moving in with me soon, what can I do to make it more comfy for him as a guy that I might not think of?",OrangeAndMaroon,AskWomen
I know women don't talk alot about sex and intimacy in general but I kinda want to know what the incedents that led to the sex and the sex itself felt like for the women that led to the second child after she has dealt with the first child and a few years of marriage.,Still_Bizazmu,AskWomen
How many people did you date before being in a successful marriage?,ProfessionalYouth,AskWomen
How to have confidence without building attraction,yCurtisd2,AskWomen
What times of the day do you like most for going on dates and why?,KindnessFreakMo,AskWomen
why tinder is not working for me and i am singl ?,bigpam47,AskWomen
Why am i worried about this,Striking-Ad-8981,AskWomen
"Respectfully asking as a male, Why is it that women get annoyed when asked to decide what to eat?",aerosmith760,AskWomen
Why do women leave usually at the first few rough patches in a relationship when their partner is loyal and willing to work through it?,Trs145,AskWomen
Where to buy swimsuits for a bigger bust?,xxkrystalkissxx,AskWomen
How to be confident with women without attracting them,yCurtisd2,AskWomen
Are you interested in participating in this study? When,Fancy_Consequence_79,AskWomen
What are some things a guy can do to show he really cares?,_Sky_Chief,AskWomen
What are some things that a guy can do to show he really cares,_Sky_Chief,AskWomen
what is considered a bad tip for hair color...i tipped $30 on a $240 hair color is that bad???,cutealmond,AskWomen
why tinder is not working for me and i am singl,bigpam47,AskWomen
How do you know if a “friend” is trying to make you look worse?,vindictachic,AskWomen
How did you personally find a way to accept your flaws?,Live_Remote_3708,AskWomen
"Sensitive, emotional women of Reddit, did you ever find a partner who reciprocated your level of emotional depth?",whatsoever--,AskWomen
"Who else has gotten pregnant off a one night stand with protection used? If so did you decide to keep the baby, adopt or abort?",Kaiviti_lewa,AskWomen
How to have a conversation with women about their experiences with pap smears?,verve_22,AskWomen
What’s an appropriate age range for a 22 year old guy to date?,throwaway10283847,AskWomen
"Ladies who start their day early, what does your morning routine look like?",watermelon_x,AskWomen
Women of Reddit: What can a man do to be more attractive if he doesn’t fit the stereotypical mold of an attractive man physically + what can he do personality wise to be more attractive?,aaron345_,AskWomen
Why do women not feel safe in most rooms?,zatn,AskWomen
What was your reason to talk to your ex?,Stranger_not_danger,AskWomen
Women! What are your women celebrity crushes?,Yeethrowawayee,AskWomen
"Women of Reddit, what does it mean to you to ""have a connection"" with someone?",Chocolate_effort,AskWomen
"What is something you and your significant other do, that is very similar?",InterestingArt4004,AskWomen
Women of Reddit who live alone/have lived alone in the past - what is your favourite thing about living alone?,Chocolate_effort,AskWomen
"Women of Reddit, how do you manage your period? (In regards to products that you use, pain management, emotions and routine etc.)",Chocolate_effort,AskWomen
What should be less spoken of?,Linorelai,AskWomen
Does anyone else feel like many sex toys are uncomfortably girthy? What do you feel is too big?,RedQueenNatalie,AskWomen
where on the clitoris do you feel the most pleasure?,smokeone234566,AskWomen
How - was I asked in a date or to hang as friends?,coldxsymphony,AskWomen
“Who” Has anyone met another person from reddit?,whoknowsxxx15,AskWomen
“Who” Has anyone met someone else from Reddit,whoknowsxxx15,AskWomen
How to deal with narcissistic friends?,brinicoleexo,AskWomen
What’s something done during sex that blew your mind?,labc24,AskWomen
What can someone do on a first date to make sure there's not going to be a second one?,My_Space_page,AskWomen
She possibly gave me an STD and she's mad at me. Who's in the wrong?,glentmorris,AskWomen
"What is one thing that you will always do, no matter how exhausted or not in the mood you are?",freakinovernada,AskWomen
How do you clean your jewelry?,Brief_Locksmith_3187,AskWomen
Partner lied about having Instagram account. How upset should I be?,Big_Class_5716,AskWomen
Would you mind if your SO cheated on you with someone who’s an identical copy of you?,Dramatic_Potato_971,AskWomen
What’s your favorite story about your grandparents?,Automatic-Lie-4223,AskWomen
"What’s your best experience of “if he wanted to, he would?”",healthierandhappier,AskWomen
what are some good tiktok beauty filters?,UnashamedLiar,AskWomen
What does this mean? If anything.,Comfortable-Phone757,AskWomen
what should i do?,uknowmedumb,AskWomen
Ever been in a relationship with a codependent partner? how was it? are you still together?,applebananapie555,AskWomen
Why do some girls stare at guys when they’re already in a relationship?,Comfortable-Phone757,AskWomen
what advice or tips can u give to me before agreeing having an ONS w someone I met online,jelliclestoopidcat,AskWomen
Why do I become significantly prettier a few days before my period?,nukethewhalezzzzz,AskWomen
Where do most of you single women go?,foursquad1,AskWomen
How Do I Tell If This Girl Likes Me Or Not/,Only_Pack_7488,AskWomen
When should I start dating again?,mythers97,AskWomen
If you stopped talking to a friend (hard breakup) did you ever reconcile and how did that happen?,pinkcarnationss,AskWomen
Why do black women have the highest rate of obesity in the world?,Shot-Discussion-9588,AskWomen
"When a women says she likes older men/guys, what exactly does that mean?",ethanwa79,AskWomen
What is something you don’t hesitate calling out when you see it/hear it?,nwhq,AskWomen
What is the most absurd thing a doctor has told you?,peachykeen051320,AskWomen
Why is it hard for me to be intimate with my long term partner?,Anouk_29,AskWomen
"Would you ever be with someone who is ""pro-life""?",SpecialAd606,AskWomen
Why am I not wanting to be as intimate with my partner as I once was.,Anouk_29,AskWomen
how do you stop feeling like shit?,Not_your_hoe_,AskWomen
How would you feel if you watched your SO/BF get his ass whooped in a fight?,carnellmusic,AskWomen
"What do you think of men with large noses (e.g Xabi Alonso, Adrien Brody..etc)?",PureSoulAndHeart,AskWomen
how do you not let guys make you feel worthless?,Not_your_hoe_,AskWomen
Has anyone gained noticeable weight after iud? How,Commercial-Break3388,AskWomen
Who’s the “Most attractive man” to ever live? (my mom says Alain Delon),mauroking,AskWomen
What would you want a close guy friend to respond with if you tell him you think you’re gaining weight or that you’re fat?,dryhairedniga2032,AskWomen
Why do many short girls like bragging about it?,Euphoric_Lifeguard43,AskWomen
When do I acknowledge that I might have to give up?,es_80,AskWomen
"women of reddit, what's the weirdest/rudest way a man reacted after you rejected him?",md2-xx,AskWomen
When do I give up hope and realize that I am SOL for reconciliation?,es_80,AskWomen
Why do I do this?,Aggravating_Fail9,AskWomen
"Women who used to be attracted to toxic people (think ""bad boy/girl"" archetype, but it of course applies to all genders), what made you stop being attracted to such individuals?",Pugunus,AskWomen
"Living in a world that’s so structured, how did you find your creative side? What’s your favorite talent that you have?",Extra_Inspection_457,AskWomen
Do you think people can change their toxic behaviour or do you think they will keep falling back into them? Why?,protonisverycool,AskWomen
What is the age where guys dont have to wear condoms because becoming pregnant is less likely?,ryanrenalds313,AskWomen
What is the team name?,sumgirl94,AskWomen
What do you think about spending money at OnlyFans versus spending it at a Strip Club?,Cyber_Tiger3,AskWomen
"Why I (F, 30) do this to myself?",Aggravating_Fail9,AskWomen
Women with PTSD from past relationships. How do you heal?,karamel_kupcake,AskWomen
Those who have experienced Night Terrors what your story?,playindaily678,AskWomen
Would you prefer quality or quantity when it comes to time spent with your partner? What is the reason for your choice?,pruneloon,AskWomen
How to stop being jealous when my friend has other friends?,Designer_Milk_674,AskWomen
how do you like to finish your partner off when he/ she is about to cum?,westerntexas,AskWomen
"What is your definition of ""cheating""?",Iwillpickonelater,AskWomen
"Why I (F, 30) hold myself accountable for this",Aggravating_Fail9,AskWomen
What are some general misconceptions regarding women in the society that offends you as a person?,cringetopiacringe,AskWomen
Someone tell me why pads/tampons aren’t free (in the US)?,mymaskedpersona,AskWomen
Do you consider your SO watching porn as cheating? Why or why not?,Iwillpickonelater,AskWomen
Would you prefer quality or quantity when it comes to time spent with your partner?,pruneloon,AskWomen
How would you feel if a man you were interested in told you they used to make gay porn?,thrownawaytoenail,AskWomen
"Why are men who flee from dangerous situations considered to be cowards, but women who flee from dangerous situations are not considered to be cowards?",gynger57,AskWomen
what did your first kiss feel like?,shakirathrowaway,AskWomen
TW: mention of rape-------- What do you think is the ideal punishment for rapists?,drama_maniac,AskWomen
Why do girls like bragging about being short?,Euphoric_Lifeguard43,AskWomen
Have you ever gotten a hematoma on your lady parts? If so what was the recovery like? Will I ever go back to normal? 😢,Readitonline12,AskWomen
How do you stop being so overwhelmed with cleaning everyday?,Mizuki928,AskWomen
Where did my male friend go wrong?,FreidMule,AskWomen
When you rest your arms on your boobs do they sag more?,BubbleGumVal,AskWomen
"Ladies, why or when would you recommend settling down with someone?",justchillinoverhere7,AskWomen
What about beards you find attractive?,Scientist-Local,AskWomen
What are some tips you wish you had known when you were a teenager?,drama_maniac,AskWomen
What do you look for in online dating?,pleasehelpmegetdates,AskWomen
Who has gone to an esthetician and what was your experience?,AdAwkward1635,AskWomen
How does it feel to be fingered by heavily callused fingers?,BlackLabelProject,AskWomen
"Women of Reddit, what were you actually doing when you replied to the guy “sorry I fell asleep”?",Special-Ad3046,AskWomen
What should I do? should I leave her or not?,goonerdb,AskWomen
"Women over 40, what are your texting/messaging preferences?",throwlikeagurll,AskWomen
What do you think about mens bulge?,Guitar1on1lesson101,AskWomen
"What books would you recommend on women's struggles, especially in America?",DrSparkle713,AskWomen
"Ladies who discovered they were lesbians after 25, what made you realize men weren’t for you?",still_on_a_whisper,AskWomen
Have you ever had a hematoma on your vagina? And if so what was the recovery like?,Readitonline12,AskWomen
"Would you like being approached by a guy on the street? If so, why?",Many-Sherbet7753,AskWomen
"Women who use menstrual cups, how do you empty the cup when using public restroom? Do you wipe your cup before putting it back in? Bloody hand?",WiihiiAii,AskWomen
How to make money 'on the side'?,Keekee-88,AskWomen
How to make some money 'on the side'.,Keekee-88,AskWomen
"Why do some people ""push food"" or otherwise sabotage efforts to lose weight?",Teacher-Investor,AskWomen
How do you get yourself to do something when you just feel worn down and tired?,Florida_Babe,AskWomen
Why do women want the guys they can’t have?,UnluckyAdvantage37,AskWomen
What can a shorter guy do make himself more attractive/appealing to women?,J_Beyonder,AskWomen
How do I react? Am I wrong?,Tinbody84,AskWomen
"For those of you who are married or engaged, did you ever have second thoughts if you were with the right one?",Elenamuffins,AskWomen
Are there any women who would be interested in giving dating advice? Essentially looking for a coach to help me post a LTR. Would be open to compensating you financially if it was the right fit.,throwawayfadeaway100,AskWomen
Who has experience of getting a hormonal IUD after BCP with history of acne?,jalison93,AskWomen
Why do I struggle to make decisions? Should I get a leadership coach?,JoySheriff,AskWomen
Why do I struggle to make decisions? Would you recommend getting a female leadership coach?,JoySheriff,AskWomen
Women of Reddit what cologne do you like on a man?,john_54321,AskWomen
"Women, what are your “go to” moves when trying to attract a guy you like?",Rred7Ppanda,AskWomen
What to eat to poop more?,Summerislandgirl,AskWomen
What to eat to poop more,Summerislandgirl,AskWomen
Why are my menstrual cycles varying?,CierraScottie13,AskWomen
How do you regain trust in a relationship?,Absolutefavourite,AskWomen
She was super into me then out of no where completely did a 180. I don't understand what happened?,mywayrdg,AskWomen
"women with bidets in their house, how do you deal with period, is it any different?",TooMuch2Take_,AskWomen
How was your birth control experience?,cdmore12,AskWomen
Do you imagine others when being intimate with your romantic partner ?,moistdragons,AskWomen
How to improve conversation skills(social anxiety) with men?,Rred7Ppanda,AskWomen
"What is something that can be a red flag, but if handled well can be a green flag?",KeyProperty2134,AskWomen
Does a man's equipment taste odd? What factors influence taste?,TooQuietForMe,AskWomen
What’s a movie you initially had low expectations of but wound up loving?,LordCosmagog,AskWomen
What is the best memory you have when you were a kid?,thatcoolguy98,AskWomen
"Hey hey heeey, who's ready to join me online",CindyMeyers_LJ,AskWomen
"felow women, when you had a moment to speak to a friend that his/her relationship was being toxic or something alike? if so, how it went?",Nightmare_Buster,AskWomen
"Partying women, how do you like to be approached in night clubs ?",BigBess7,AskWomen
Be Loud And Proud! How often do you think about sex per day?,thatcoolguy98,AskWomen
"Women who goes clubbing, any advice on how to seduce you in night clubs ?",BigBess7,AskWomen
"What characteristics makes someone ""attractive"" to you?",midnight_reborn,AskWomen
What percentage of men do you think cheat on their wives/girlfriends?,delusionsofsqualor,AskWomen
"Protective mothers, what made you protective over your child?",Morigi_ana123,AskWomen
"According to Men's Health research, women think about sex half the time as men? What are you thoughts?",thatcoolguy98,AskWomen
"Women who dated for money, how did it work out?",ConfusedCapybara123,AskWomen
why have women been so silent about the unethical male-only draft that's happening in ukraine ?,[deleted],AskWomen
What simple or small things done or given by your partner makes you happy?,Heavy-Flamingo6822,AskWomen
What is the solution to this clear misogyny in a corporate environment?,RogerMaria,AskWomen
How did you learn to forgive yourself?,kanohipuru,AskWomen
When was it that you settled comfortably into a winter/spring relationship with a man?,kidsforgodmovement,AskWomen
How do you deal with your friend being friends with an ex close friend?,buddabowl,AskWomen
Why does Gen Z seem to be so misogynistic?,EverybodySupernova,AskWomen
How do you cure/handle vaginismus?,manateerainbowbabe,AskWomen
When did you start embracing the fact that you are the main character of your life?,donaldyuck,AskWomen
"Women who used to like bad boys before, but not anymore, what made you change your mind?",Pugunus,AskWomen
"Women who used to like ""bad boys"" before, but not anymore",Pugunus,AskWomen
What was your favorite age growing up?,Automatic-Lie-4223,AskWomen
"Would you be open to a relationship with somebody who isn’t, and probably never will be, interested in sex? Why/Why not?",sanitychaos,AskWomen
Be honest: What do you think of the dad-bod?,YourWenisIsShowing,AskWomen
"Women of Reddit, would you date a guy who is really smart and kind but not attractive physically ?",xVolt_,AskWomen
"What hair situation makes you go, “thank goodness” or “oh hell no”?",Wolfe_Johnson,AskWomen
did anyone have second thoughts about marrying their SO just before the wedding? if so why?,orangejuiceexists,AskWomen
"How common would you say misandry is compared to misogyny, and do you think it’s overlooked?",itbettersnow,AskWomen
When do you know it's love and not lust?,lifeisunkind,AskWomen
What is something you like about men most people dont?,Pedri20,AskWomen
Women who dated someone 100% only for their looks how did things turn out?,Morigi_ana123,AskWomen
"Mothers of sons, what life lessons do you teach them?",SoyUnFracaso,AskWomen
What did you all do with your memory box of your ex if you stayed in good terms?,cyclequeen35,AskWomen
How should I (30M) approach first sex with new partner?,ghostdemon_678,AskWomen
My period pain is extremely terrible right now what are your cramping remedies ? I need help,Mental_Log4115,AskWomen
My Lewis pain is extremely terrible right now what are your cramping remedies ? I need help,Mental_Log4115,AskWomen
Who Else Is In The Menopause and What Are You Doing To Help Yourself?,shipsandchampagne,AskWomen
"if you could give love advice to your 16yo self, what it would be?",ValsBoobs_Fanpage,AskWomen
What’s your favorite tights/pantyhose?,RadicalQuirk,AskWomen
What did a person you liked do that caused you to lose all attraction you felt towards that person?,belajsuz7,AskWomen
How does your parents react when they see your partner for the first time ?,Vazeer9485,AskWomen
How does one find their style?,donaldyuck,AskWomen
"Women of reddit, at what age did you have your first sexual experience?",LMLY2,AskWomen
What am I supposed to do? Today my girlfriend randomly asked me if I ever sent a nude to my ex.,EtherealSpectre729,AskWomen
What is the longest time you had a crush on someone and didn’t tell them?,kroszta,AskWomen
How do you control PMS Hormones side effects?,missfit97,AskWomen
has a s/o parent hated you? if so? why?,Iknowuramazing,AskWomen
"Ladies in a 25 year plus relationship, how do you really feel about sex with your partner?",THItalian,AskWomen
"Ladies in a long term relationship, how do you really feel about sex with your partner.",THItalian,AskWomen
when do girls realise they found the perfect one?,Iknowuramazing,AskWomen
what goes through a girls mind when a guy u like tells u smth funny,Iknowuramazing,AskWomen
How long can you go without noticing the rupture of fallopian tube?,SensePossible4945,AskWomen
how did you tell your parents that you want to move out?,catscuteears,AskWomen
At what age did you stop caring about putting makeup to compete with other females?,TheTruth221,AskWomen
"Women of Reddit who suffer with PMS/PMDD, what helps?",[deleted],AskWomen
"Women who suffer from bad PMS/PMDD, what do you do to prepare for it each month and is there anything that helps the emotional symptoms?",MajesticDays,AskWomen
Who knows how to use cloves water for hair?,marymuna,AskWomen
What’s your favorite way to masturbate?,SnooAvocados270,AskWomen
Bartholin’s glands and how to unclog them?,Character_Ad5222,AskWomen
Meet when in traffic/highway,Throwaway8219826,AskWomen
What small gestures or things did your partner do in the early stages of dating that left a lasting impression on you?,poobreakphilosopher,AskWomen
Why do Women hate Future?,LiterallyJustDev,AskWomen
"To all the big breasted ladies, which alternatives for bras are you currently using? Any recommendations?",Greenwitchynoobie,AskWomen
How to buy lingerie for my girlfriend?,RedAgentGhost,AskWomen
"While giving birth, if it was between you dying, or your baby, who would you want your partner to save?",Apeeeu_,AskWomen
Why do I hate the male genital (p*nis) but I'm a straight girl...it's like I'd rather have sex with woman's genitals (not woman tho) mostly because I can relate to it. has anyone experienced this before ?,curiousme2316,AskWomen
What was your breaking point and how did you recover ?,coolgirl_not4,AskWomen
When did you realise you've reached your breaking point and how did you get over it ?,coolgirl_not4,AskWomen
My girl (18 F) is threatening me(19 M) that she will destroy me . what do i do ?,immabotyou,AskWomen
What do you think about online relationships? Do you think it's stupid to look for companionship in the virtual world?,idleinsanity9,AskWomen
"Women, the world has gotten into nudity and forgot intimacy, what are your views?",Chintan-99,AskWomen
how is asking about period not allowed here?,nope-ok,AskWomen
"Women of reddit, what is something you've learnt from your past relationships?",Chintan-99,AskWomen
"what do you prefer, circumcis3d or not?",iprobablyneedhelpl0l,AskWomen
"Has your mom ever been jealous of you? If so, why?",sataneatstomatoes,AskWomen
Would you be willing to marry a guy who has the brain of a 2 year old? For a guaranteed financially good life,idkjustredditing2,AskWomen
"when you had over 61 days of no flow, is that normal?",nope-ok,AskWomen
How should a man help a woman who's in trouble if he doesn't know her?,FearMySpeed,AskWomen
"I’m curious, what do you think is the greatest superpower to being a woman?",Greenwitchynoobie,AskWomen
"As a man, should I intervene when I see a woman engineer being constantly teased at work by the same guy?",redryder74,AskWomen
what is a parenting mistake you made?,SpecialAd606,AskWomen
When should I message a girl I was interested in again?,TangeloPlenty,AskWomen
"Ladies, why do some many of you give wrong signals? Hide true emotions?",beastbloodkiller,AskWomen
Has anyone voluntarily remained single until age 24 and older? How was your relational outcome from that point onwards?!,TravelTings,AskWomen
How often do you wax?,JustHereToDrinkMilk,AskWomen
"A very good female friend (and ex gf) of mine seems to be in quite a negative headspace, or bad mood regarding me. How can I bring it up without upsetting them or starting a conflict?",Low_Argument9299,AskWomen
How do I get a girl with daddy issues to fall in love with me?,TeaThese3163,AskWomen
"Women who do nails, do you like your job?",clairlunaclair,AskWomen
what do you think of online dating? I mean i got zero matches and my profile is not that bad.,Karn_theunsunghero,AskWomen
How do you guys feel about cutting contact with a toxic parent? Is your life better now?,DaisyVioletRose,AskWomen
What is the perfect price for a bikini set?,Al_Bruin,AskWomen
What? Maxixes Cured Baldness: MAXIXES . C O M,BOOFold2822,AskWomen
What. Maxixes Cured Baldness: MAXIXES . C O M,BOOFold2822,AskWomen
Whose actually reaching climax during PIV sex?,Jojo4444333,AskWomen
bald/shaved/balding men hat or no hat what's your opinion,MikeyBonbon1988,AskWomen
What can my friend do who is forcefully getting married to a stranger (USA) ?,GeneralKenobisPupil,AskWomen
What feminine hygiene product should every man have at home for guests?,Jaceholt,AskWomen
"What can my friend do, she is forcefully getting married to a guy she doesn’t even know",GeneralKenobisPupil,AskWomen
is it common for women to refuse/have no interest in performing fellatio and why?,Throbbing_Man_Meat,AskWomen
